{
  "case_id": "chembl_downloader_assay_chembl1040694_exact",
  "corpus": "web_scrape_hq",
  "split": null,
  "db_path": "database/latest/chembl_36/chembl_36_sqlite/chembl_36.db",
  "artifacts": {
    "uq_surface": "tests/fixtures/web_scrape71/chembl_downloader_assay_chembl1040694_exact/uq.txt",
    "up_exec": "tests/fixtures/web_scrape71/chembl_downloader_assay_chembl1040694_exact/up_exec.txt",
    "sql_gold": "tests/fixtures/web_scrape71/chembl_downloader_assay_chembl1040694_exact/sqlite.sql",
    "res_gold": "tests/fixtures/web_scrape71/chembl_downloader_assay_chembl1040694_exact/ground-truth.csv.zst",
    "uq_benchmark_spec": "tests/fixtures/web_scrape71/chembl_downloader_assay_chembl1040694_exact/benchmark_spec_uq.txt",
    "res_gold_presentation": null,
    "source_sql": "tests/fixtures/web_scrape71/chembl_downloader_assay_chembl1040694_exact/source.sql",
    "sqlite_sql": "tests/fixtures/web_scrape71/chembl_downloader_assay_chembl1040694_exact/sqlite.sql",
    "documentation": "tests/fixtures/web_scrape71/chembl_downloader_assay_chembl1040694_exact/documentation.txt"
  },
  "metadata": {
    "family": "assay_exact",
    "origin": "templated_from_sql",
    "source_title": "chembl_downloader get_assay_sql instantiated for CHEMBL1040694",
    "source_url": "https://github.com/cthoyt/chembl-downloader/blob/main/src/chembl_downloader/queries.py",
    "realism_level": "realistic_surface",
    "ambiguity_level": "unambiguous",
    "size_class": "medium",
    "expected_output_columns": [
      "canonical_smiles",
      "chembl_id",
      "standard_type",
      "standard_relation",
      "standard_value",
      "standard_units"
    ],
    "sort_keys": [
      "canonical_smiles",
      "chembl_id",
      "standard_type",
      "standard_relation",
      "standard_value",
      "standard_units"
    ],
    "tags": [
      "assay_exact",
      "medium",
      "wave1"
    ],
    "allows_multiple_sql_forms": true,
    "requires_schema_alias_fidelity": false,
    "normalize": {
      "lowercase_columns": true,
      "strip_values": true,
      "lowercase_values": []
    },
    "column_rename_map": {},
    "float_cols": [],
    "int_cols": [],
    "float_tol": 1e-06,
    "notes": "Staged assay_exact wave-1 case generated from grounded SQL. NOVARTIS: Inhibition Frequency Index (IFI) - the number of HTS assays where a compound showed > 50% inhibition/induction, expressed as a percentage of the numbe"
  }
}
