{
  "case_id": "baoilleach_human_cgmp_target_descriptions",
  "corpus": "web_scrape_hq",
  "split": null,
  "db_path": "database/latest/chembl_36/chembl_36_sqlite/chembl_36.db",
  "artifacts": {
    "uq_surface": "tests/fixtures/web_scrape/baoilleach_human_cgmp_target_descriptions/uq.txt",
    "up_exec": null,
    "sql_gold": "tests/fixtures/web_scrape/baoilleach_human_cgmp_target_descriptions/sqlite.sql",
    "res_gold": "tests/fixtures/web_scrape/baoilleach_human_cgmp_target_descriptions/ground-truth.csv.zst",
    "uq_benchmark_spec": null,
    "res_gold_presentation": null,
    "source_sql": "tests/fixtures/web_scrape/baoilleach_human_cgmp_target_descriptions/source.sql",
    "sqlite_sql": "tests/fixtures/web_scrape/baoilleach_human_cgmp_target_descriptions/sqlite.sql",
    "documentation": "tests/fixtures/web_scrape/baoilleach_human_cgmp_target_descriptions/documentation.txt"
  },
  "metadata": {
    "family": "other",
    "origin": "inferred_from_sql",
    "source_title": "ChEMBL SQL queries gist by baoilleach",
    "source_url": "https://gist.github.com/1056279",
    "realism_level": "realistic_surface",
    "ambiguity_level": "unambiguous",
    "size_class": "small",
    "expected_output_columns": [
      "target_description"
    ],
    "sort_keys": [
      "target_description"
    ],
    "tags": [
      "other",
      "small"
    ],
    "allows_multiple_sql_forms": true,
    "requires_schema_alias_fidelity": true,
    "normalize": {
      "lowercase_columns": true,
      "strip_values": true,
      "lowercase_values": []
    },
    "column_rename_map": {
      "pref_name": "target_description",
      "target_name": "target_description",
      "target_description": "target_description"
    },
    "float_cols": [],
    "int_cols": [],
    "float_tol": 1e-06,
    "notes": "Migrated automatically from the v4 web_scrape_hq registry."
  }
}
